{
  "$schema": "http://json-schema.org/draft-07/schema#",
  "$id": "launcher-settings.json",
  "title": "Paradox Launcher Settings",
  "description": "Paradox game launcher configuration file (launcher-settings.json), located in the game root directory or its launcher/ subdirectory.",
  "type": "object",
  "properties": {
    "gameId": {
      "type": "string",
      "description": "Unique identifier for the game (e.g. \"stellaris\", \"ck3\", \"eu4\")."
    },
    "version": {
      "type": "string",
      "description": "Full display version string for the game, typically including a version name, version number, and build identifier (e.g. \"Cetus v4.3.2 (171a)\")."
    },
    "rawVersion": {
      "type": "string",
      "description": "Raw version number of the game (e.g. \"v4.3.2\")."
    },
    "distPlatform": {
      "type": "string",
      "description": "Distribution platform for the game (e.g. \"steam\", \"gog\", \"microsoft\")."
    },
    "gameDataPath": {
      "type": "string",
      "description": "Path to the game data directory. May contain placeholders such as %USER_DOCUMENTS% (e.g. \"%USER_DOCUMENTS%/Paradox Interactive/Stellaris\")."
    },
    "themeFile": {
      "type": "string",
      "description": "Relative path to the launcher theme configuration file (e.g. \"./assets/theme-settings.json\")."
    },
    "browserDlcUrl": {
      "type": "string",
      "format": "uri",
      "description": "URL to open the DLC store page in the browser."
    },
    "exePath": {
      "type": "string",
      "description": "Relative path to the game executable (e.g. \"./stellaris.exe\")."
    },
    "exeArgs": {
      "type": "array",
      "description": "Command-line arguments passed to the game executable on launch.",
      "items": {
        "type": "string",
        "description": "A single command-line argument (e.g. \"-gdpr-compliant\")."
      }
    },
    "ingameSettingsLayoutPath": {
      "type": "string",
      "description": "Relative path to the in-game settings layout file (e.g. \"./settings-layout.json\")."
    },
    "alternativeExecutables": {
      "type": "array",
      "description": "List of alternative launch modes available to the user (e.g. cross-store multiplayer).",
      "items": {
        "$ref": "#/definitions/alternativeExecutable"
      }
    }
  },
  "additionalProperties": true,
  "definitions": {
    "alternativeExecutable": {
      "type": "object",
      "description": "Configuration for an alternative executable entry, defining an additional way to launch the game.",
      "properties": {
        "exePath": {
          "type": "string",
          "description": "Relative path to the game executable for this alternative launch mode."
        },
        "exeArgs": {
          "type": "array",
          "description": "Command-line arguments passed to the executable for this alternative launch mode.",
          "items": {
            "type": "string"
          }
        },
        "label": {
          "type": "object",
          "description": "Localized display name for this alternative launch mode. Keys are IETF language tags (e.g. \"en\", \"zh-hans\"); values are the corresponding display strings.",
          "additionalProperties": {
            "type": "string",
            "description": "Display name in the corresponding language."
          }
        },
        "visibleIn": {
          "type": "array",
          "description": "List of launcher UI locations where this alternative launch mode is shown (e.g. \"GAME_SETTINGS\", \"HOME_PAGE\").",
          "items": {
            "type": "string",
            "description": "UI location identifier."
          }
        }
      },
      "additionalProperties": true
    }
  }
}
